{
  "manifest": {
    "schemaVersion": "1.0.0",
    "format": "viewer-bundle",
    "viewSelector": "context:*",
    "baseRevision": "blake3:0136855fa8def7b5c7511a22a85aab3dfb2384216fb25823d7a526f9cb445f06",
    "generatedAt": "2026-08-03T12:00:00Z",
    "elementCount": 4,
    "edgeCount": 3,
    "evidenceCount": 0
  },
  "projection": {
    "nodes": [
      {
        "id": "person:user",
        "type": "context",
        "name": "User",
        "description": "A regular user of the platform",
        "canonicalKey": "user"
      },
      {
        "id": "system:archctl",
        "type": "context",
        "name": "archctl",
        "description": "CLI sidecar that emits architecture bundles",
        "canonicalKey": "archctl"
      },
      {
        "id": "system:archview",
        "type": "context",
        "name": "archview",
        "description": "Web workbench that consumes archctl bundles",
        "canonicalKey": "archview"
      },
      {
        "id": "system:ci",
        "type": "context",
        "name": "CI Pipeline",
        "description": "Continuous integration",
        "canonicalKey": "ci"
      }
    ],
    "edges": [
      {
        "id": "rel:0",
        "source": "person:user",
        "target": "system:archctl",
        "predicate": "uses"
      },
      {
        "id": "rel:1",
        "source": "person:user",
        "target": "system:archview",
        "predicate": "uses"
      },
      {
        "id": "rel:2",
        "source": "system:ci",
        "target": "system:archctl",
        "predicate": "validates"
      }
    ]
  },
  "evidence": {
    "evidence": []
  },
  "styles": {
    "theme": "default",
    "version": "1.0.0",
    "elementColors": {
      "context": "#1168bd",
      "container": "#438dd5",
      "component": "#85b8e8",
      "dynamic": "#2694ab",
      "deployment": "#999999"
    },
    "edgeColors": {
      "default": "#707070"
    }
  }
}
